{
  "counts": {
    "accepted": 9200,
    "duplicate": 0,
    "expected": 9200,
    "extra": 0,
    "missing": 0,
    "rejected": 0
  },
  "generated_at": "2026-09-29T12:00:00+00:00",
  "outputs": [
    {
      "path": "overview.json",
      "sha256": "0000000000000000000000000000000000000000000000000000000000000000"
    }
  ],
  "protocol_hash": "0000000000000000000000000000000000000000000000000000000000000000",
  "protocol_version": 7,
  "publication_complete": true,
  "release_id": "publication_seed101_v1",
  "schema_version": 3,
  "selected_checkpoint_hashes": [
    "0000000000000000000000000000000000000000000000000000000000000000",
    "0000000000000000000000000000000000000000000000000000000000000000",
    "0000000000000000000000000000000000000000000000000000000000000000",
    "0000000000000000000000000000000000000000000000000000000000000000",
    "0000000000000000000000000000000000000000000000000000000000000000",
    "0000000000000000000000000000000000000000000000000000000000000000",
    "0000000000000000000000000000000000000000000000000000000000000000",
    "0000000000000000000000000000000000000000000000000000000000000000",
    "0000000000000000000000000000000000000000000000000000000000000000",
    "0000000000000000000000000000000000000000000000000000000000000000",
    "0000000000000000000000000000000000000000000000000000000000000000",
    "0000000000000000000000000000000000000000000000000000000000000000",
    "0000000000000000000000000000000000000000000000000000000000000000",
    "0000000000000000000000000000000000000000000000000000000000000000",
    "0000000000000000000000000000000000000000000000000000000000000000",
    "0000000000000000000000000000000000000000000000000000000000000000",
    "0000000000000000000000000000000000000000000000000000000000000000",
    "0000000000000000000000000000000000000000000000000000000000000000",
    "0000000000000000000000000000000000000000000000000000000000000000",
    "0000000000000000000000000000000000000000000000000000000000000000",
    "0000000000000000000000000000000000000000000000000000000000000000",
    "0000000000000000000000000000000000000000000000000000000000000000",
    "0000000000000000000000000000000000000000000000000000000000000000",
    "0000000000000000000000000000000000000000000000000000000000000000",
    "0000000000000000000000000000000000000000000000000000000000000000",
    "0000000000000000000000000000000000000000000000000000000000000000",
    "0000000000000000000000000000000000000000000000000000000000000000",
    "0000000000000000000000000000000000000000000000000000000000000000",
    "0000000000000000000000000000000000000000000000000000000000000000",
    "0000000000000000000000000000000000000000000000000000000000000000",
    "0000000000000000000000000000000000000000000000000000000000000000",
    "0000000000000000000000000000000000000000000000000000000000000000",
    "0000000000000000000000000000000000000000000000000000000000000000",
    "0000000000000000000000000000000000000000000000000000000000000000",
    "0000000000000000000000000000000000000000000000000000000000000000",
    "0000000000000000000000000000000000000000000000000000000000000000",
    "0000000000000000000000000000000000000000000000000000000000000000",
    "0000000000000000000000000000000000000000000000000000000000000000",
    "0000000000000000000000000000000000000000000000000000000000000000",
    "0000000000000000000000000000000000000000000000000000000000000000"
  ],
  "selection_hash": "0000000000000000000000000000000000000000000000000000000000000000",
  "source_commit": "8fd0e625b0535502fada77020e6db418939e2225",
  "strict_runtime_comparability": false
}
